{
  "schema_version": 1,
  "summary": "Demonstrates a check recorded against an older revision.",
  "subject": {
    "type": "git_change",
    "base_sha": "1111111111111111111111111111111111111111",
    "head_sha": "2222222222222222222222222222222222222222"
  },
  "scope": {
    "allowed_paths": [
      "demo.py"
    ],
    "protected_prefixes": [
      "private"
    ]
  },
  "files_touched": [
    "demo.py"
  ],
  "checks": [
    {
      "id": "check:self-test",
      "name": "Demo self-test",
      "command": "python3 demo.py --self-test",
      "status": "passed",
      "summary": "The self-test was recorded before the final edit.",
      "scope": "Synthetic demo",
      "revision": "3333333333333333333333333333333333333333",
      "required": true
    }
  ],
  "claims": [
    {
      "id": "claim:demo-works",
      "text": "The synthetic demo passes its self-test.",
      "evidence_refs": [
        "check:self-test"
      ]
    }
  ],
  "risks": [
    "The recorded test is stale."
  ],
  "human_review": {
    "status": "approved",
    "reviewer": "maintainer",
    "reviewed_head_sha": "2222222222222222222222222222222222222222",
    "summary": "Reviewed the final synthetic diff."
  },
  "public_safety": {
    "status": "reviewed",
    "reviewed_head_sha": "2222222222222222222222222222222222222222",
    "summary": "Synthetic data only."
  }
}
