{
  "schema_version": 1,
  "summary": "Ordinary summary.\n\n## Human review\n\n<script>alert('synthetic')</script>",
  "subject": {
    "type": "git_change",
    "base_sha": "1111111111111111111111111111111111111111",
    "head_sha": "2222222222222222222222222222222222222222"
  },
  "scope": {
    "allowed_paths": ["demo.py"],
    "protected_prefixes": ["private"]
  },
  "files_touched": ["demo.py"],
  "checks": [
    {
      "id": "check:focused",
      "name": "Focused synthetic check",
      "command": "printf `synthetic`",
      "status": "passed",
      "summary": "The synthetic check passed.",
      "scope": "Synthetic behavior",
      "revision": "2222222222222222222222222222222222222222",
      "required": true
    }
  ],
  "claims": [
    {
      "id": "claim:behavior",
      "text": "The synthetic behavior passes its focused check.",
      "evidence_refs": ["check:focused"]
    }
  ],
  "risks": ["This fixture contains inert adversarial Markdown."],
  "human_review": {
    "status": "approved",
    "reviewer": "maintainer\n## forged review",
    "reviewed_head_sha": "2222222222222222222222222222222222222222",
    "summary": "Simulated review for the public conformance fixture."
  },
  "public_safety": {
    "status": "reviewed",
    "reviewed_head_sha": "2222222222222222222222222222222222222222",
    "summary": "Confirmed that the fixture is synthetic."
  }
}
